{
  "$schema": "../docs/physics.schema.json",
  "simulation": {
    "mesh_path": "mesh_data/busbar_order2.msh",
    "order": 2,
    "uniform_refinement_levels": 0,
    "solver": "pcg",
    "output_dir": "results/busbar_oneway_order2",
    "log_level": "info",
    "comsol_reference_path": "results/busbar_oneway_order2_temperature.txt",
    "compare_args": ""
  },
  "materials": [
    {
      "name": "copper",
      "properties": {
        "diffusion": "400.0",
        "electrical_conductivity": "5.998e7"
      }
    },
    {
      "name": "titanium",
      "properties": {
        "diffusion": "7.5",
        "electrical_conductivity": "7.407e5"
      }
    }
  ],
  "material_to_attributes": {
    "copper": [1],
    "titanium": [2, 3, 4, 5, 6, 7]
  },
  "fields": [
    {
      "type": "electrostatic",
      "source_default": "0.0",
      "dirichlet_boundary_conditions": [
        {
          "bdr_attributes": [43],
          "value": 0.02
        },
        {
          "bdr_attributes": [8, 15],
          "value": 0.0
        }
      ]
    },
    {
      "type": "thermal",
      "source_default": "0.0",
      "initial_temperature": 293.15,
      "robin_boundary_conditions": [
        {
          "bdr_attributes": [
            1, 2, 3, 4, 5, 6, 7, 12, 13, 14, 19, 20, 22, 24, 26, 28, 29, 30, 31,
            32, 37, 39, 40, 41, 42
          ],
          "l": 5.0,
          "q": 1465.75
        }
      ]
    }
  ]
}
